1067	608	1.10.19	καὶ νὴ Δία ἐάν τις τῶν γονέων τελευτησάντων τοὺς τάφους μὴ κοσμῇ , καὶ τοῦτο ἐξετάζει ἡ πόλις ἐν ταῖς τῶν ἀρχόντων δοκιμασίαις .		They had had no breakfast, either.	['ἐν']	1	['ἐν']	['AuxP']
1094	6	1.1.3	θύων τε γὰρ φανερὸς ἦν πολλάκις μὲν οἴκοι , πολλάκις δὲ ἐπὶ τῶν κοινῶν τῆς πόλεως βωμῶν , καὶ μαντικῇ χρώμενος οὐκ ἀφανὴς ἦν .		When Darius had died and Artaxerxes had become established as king, Tissaphernes falsely accused Cyrus to his brother of plotting against him.	['γάρ', 'μέν', 'οὐ']	3	['γὰρ', 'μὲν', 'οὐκ']	['AuxY', 'AuxY', 'AuxZ']
1095	112	1.2.20	ἐν γὰρ τῷ αὐτῷ σώματι συμπεφυτευμέναι τῇ ψυχῇ αἱ ἡδοναὶ πείθουσιν αὐτὴν μὴ σωφρονεῖν , ἀλλὰ τὴν ταχίστην ἑαυταῖς τε καὶ τῷ σώματι χαρίζεσθαι .		He sent some of Menon’s troops to escort her, Menon himself commanding them.	['ἀλλά', 'γάρ', 'ἐν']	3	['ἀλλὰ', 'γὰρ', 'ἐν']	['AuxY', 'AuxY', 'AuxP']
1096	160	1.3.7	λέγεται γὰρ Ἀλκιβιάδην , πρὶν εἴκοσιν ἐτῶν εἶναι , Περικλεῖ ἐπιτρόπῳ μὲν ὄντι αὐτοῦ , προστάτῃ δὲ τῆς πόλεως , τοιάδε διαλεχθῆναι περὶ νόμων ·		More than two thousand of the troops under Xenias and Pasion took their arms and their baggage train and encamped with Clearchus.	['γάρ', 'μέν']	2	['γὰρ', 'μὲν']	['AuxY', 'AuxY']
1097	169	1.3.10	ἐὰν δὲ μὴ τὸ πλῆθος , ἀλλ’ , ὥσπερ ὅπου ὀλιγαρχία ἐστίν , ὀλίγοι συνελθόντες γράψωσιν ὅ τι χρὴ ποιεῖν , ταῦτα τί ἐστι ;		Therefore, although he keeps sending for me, I decline to go, chiefly, it is true, from a feeling of shame, because I am conscious that I have proved utterly false to him, but, besides that, from fear that he may seize me and inflict punishment upon me for the wrongs he thinks he has suffered at my hands.	['ἀλλά']	1	['ἀλλ’']	['AuxY']
1098	206	1.3.21	τοῦτο δὴ λέγειν αὐτόν , ὡς ὁ ποιητὴς κελεύει μηδενὸς ἔργου μήτ’ ἀδίκου μήτ’ αἰσχροῦ ἀπέχεσθαι , ἀλλὰ καὶ ταῦτα ποιεῖν ἐπὶ τῷ κέρδει .		They asked, however, for more pay.	['ἀλλά', 'ἔργον']	2	['ἀλλὰ', 'ἔργου']	['AuxY', 'OBJ']
1099	222	1.4.4	ἀλλὰ Σωκράτης γε καὶ πρὸς τοὺς ἄλλους ἀνθρώπους κόσμον τῇ πόλει παρεῖχε πολλῷ μᾶλλον ἢ Λίχας τῇ Λακεδαιμονίων , ὃς ὀνομαστὸς ἐπὶ τούτῳ γέγονε .		and it was not possible to effect a passage by force.	['ἄνθρωπος', 'ἀλλά']	2	['ἀνθρώπους', 'ἀλλὰ']	['ADV', 'AuxY']
1100	251	1.4.11	σίτῳ μὲν γὰρ τοσούτῳ ἐχρῆτο , ὅσον ἡδέως ἤσθιε , καὶ ἐπὶ τοῦτο οὕτω παρεσκευασμένος ᾔει ὥστε τὴν ἐπιθυμίαν τοῦ σίτου ὄψον αὐτῷ εἶναι ·		and on the river was situated a large and prosperous city named Thapsacus.	['γάρ', 'μέν']	2	['γὰρ', 'μὲν']	['AuxY', 'AuxY']
1101	273	1.4.17	οὐκ οἶσθ’ ὅτι τὰ φαλάγγια οὐδ’ ἡμιωβελιαῖα τὸ μέγεθος ὄντα προσαψάμενα μόνον τῷ στόματι ταῖς τε ὀδύναις ἐπιτρίβει τοὺς ἀνθρώπους καὶ τοῦ φρονεῖν ἐξίστησι ;		After so doing Cyrus proceeded to cross the river.	['ἄνθρωπος', 'οὐ']	2	['ἀνθρώπους', 'οὐκ']	['OBJ', 'AuxZ']
1102	323	1.5.11	τὸ δὲ καὶ τὰς τῶν ἀφροδισίων ἡδονὰς τοῖς μὲν ἄλλοις ζῴοις δοῦναι περιγράψαντας τοῦ ἔτους χρόνον , ἡμῖν δὲ συνεχῶς μέχρι γήρως ταῦτα παρέχειν .		There one of Menon’s soldiers and one of Clearchus’ men had some dispute, and Clearchus, deciding that Menon’s man was in the wrong, gave him a flogging.	['μέν']	1	['μὲν']	['AuxY']
1103	400	1.7.4	καὶ πάλιν ποτὲ τοῦ Ἀντιφῶντος ἐρομένου αὐτόν , πῶς ἄλλους μὲν ἡγεῖται πολιτικοὺς ποιεῖν , αὐτὸς δ’ οὐ πράττει τὰ πολιτικά , εἴπερ ἐπίσταται ·		But if you be men and if my undertaking turn out well, I shall make anyone among you who wishes to return home an object of envy to his friends at home upon his return, while I shall cause many of you, I imagine, to choose life with me in preference to life at home.	['μέν', 'οὐ']	2	['μὲν', 'οὐ']	['AuxY', 'AuxZ']
1104	445	1.8.2	ὥσπερ οἱ μοιχοὶ εἰσέρχονται εἰς τὰς εἰρκτάς , εἰδότες ὅτι κίνδυνος τῷ μοιχεύοντι ἅ τε ὁ νόμος ἀπειλεῖ παθεῖν καὶ ἐνεδρευθῆναι καὶ ληφθέντα ὑβρισθῆναι ·		for the thought of the Greeks, and of all the rest in fact, was that he would fall upon them immediately, while they were in disorder;	['εἰς', 'κίνδυνος']	2	['εἰς', 'κίνδυνος']	['AuxP', 'OBJ/SBJ']
1134	86	1.2.12	ἐγὼ μὲν γὰρ ἡγοῦμαι , θεοῦ διδόντος αὐτοῖν ἢ ζῆν ὅλον τὸν βίον ὥσπερ ζῶντα Σωκράτην ἑώρων ἢ τεθνάναι , ἑλέσθαι ἂν μᾶλλον αὐτὼ τεθνάναι .		and people said that Cyrus had intimate relations with the queen.	['γάρ', 'μέν']	2	['γὰρ', 'μὲν']	['AuxY', 'AuxY']
1135	117	1.2.21	ὅτι δὲ νέω ὄντε αὐτώ , ἡνίκα καὶ ἀγνωμονεστάτω καὶ ἀκρατεστάτω εἰκὸς εἶναι , Σωκράτης παρέσχε σώφρονε , οὐδενὸς ἐπαίνου δοκεῖ τῷ κατηγόρῳ ἄξιος εἶναι ;		Now the entrance was by a wagon-road, exceedingly steep and impracticable for an army to pass if there was anybody to oppose it;	['ἄξιος']	1	['ἄξιος']	['PNOM']
1136	149	1.3.3	ὁ δὲ Κριτίας , ἀλλὰ τῶνδέ τοί σε ἀπέχεσθαι , ἔφη , δεήσει , ὦ Σώκρατες , τῶν σκυτέων καὶ τῶν τεκτόνων καὶ τῶν χαλκέων ·		For Cyrus became my friend and not only honoured me, an exile from my fatherland, in various ways, but gave me ten thousand darics.	['ἀλλά']	1	['ἀλλὰ']	['AuxY']
1137	164	1.3.8	ὡς ἐγὼ ἀκούων τινῶν ἐπαινουμένων , ὅτι νόμιμοι ἄνδρες εἰσίν , οἶμαι μὴ ἂν δικαίως τούτου τυχεῖν τοῦ ἐπαίνου τὸν μὴ εἰδότα τί ἐστι νόμος .		He himself, he said, would refuse to go.	['δίκαιος']	1	['δικαίως']	['ADV']
1138	257	1.4.13	τὸν δὲ Ὀδυσσέα Ἑρμοῦ τε ὑποθημοσύνῃ καὶ αὐτὸν ἐγκρατῆ ὄντα καὶ ἀποσχόμενον τοῦ ὑπὲρ τὸν κόρον τῶν τοιούτων ἅπτεσθαι , διὰ ταῦτα οὐ γενέσθαι ὗν .		All these things the generals reported back to Cyrus.	['διά', 'οὐ']	2	['διὰ', 'οὐ']	['AuxP', 'AuxZ']
1139	573	1.10.3	οὓς οἱ γονεῖς ἐκ μὲν οὐκ ὄντων ἐποίησαν εἶναι , τοσαῦτα δὲ καλὰ ἰδεῖν καὶ τοσούτων ἀγαθῶν μετασχεῖν , ὅσα οἱ θεοὶ παρέχουσι τοῖς ἀνθρώποις ·		The Milesian woman, however, the younger one, after being seized by the King’s men made her escape, lightly clad, to some Greeks who had chanced to be standing guard amid the baggage train and, forming themselves in line against the enemy, had killed many of the plunderers, although some of their own number had been killed also;	['ἀγαθός', 'οὐ', 'μέν', 'ἐκ', 'ἄνθρωπος', 'καλός']	6	['ἀγαθῶν', 'οὐκ', 'μὲν', 'ἐκ', 'ἀνθρώποις', 'καλὰ']	['OBJ', 'AuxZ', 'AuxY', 'AuxP', 'OBJ', 'OBJ']
1169	80	1.2.11	Κριτίας μὲν γὰρ τῶν ἐν τῇ ὀλιγαρχίᾳ πάντων πλεονεκτίστατός τε καὶ βιαιότατος ἐγένετο , Ἀλκιβιάδης δὲ αὖ τῶν ἐν τῇ δημοκρατίᾳ πάντων ἀκρατέστατός τε καὶ ὑβριστότατος .		He all the while expressed hopes, and was manifestly troubled;	['γάρ', 'ἐν', 'μέν']	3	['γὰρ', 'ἐν', 'μὲν']	['AuxY', 'AuxP', 'AuxY']
1170	93	1.2.15	οἶδα δὲ κ- ἐκείνω σωφρονοῦντε , ἔστε Σωκράτει συνήστην , οὐ φοβουμένω μὴ ζημιοῖντο ἢ παίοιντο ὑπὸ Σωκράτους , ἀλλ’ οἰομένω τότε κράτιστον εἶναι τοῦτο πράττειν .		He ordered the Greeks to form their lines and take their positions just as they were accustomed to do for battle, each general marshalling his own men.	['ἀλλά', 'οὐ']	2	['ἀλλ’', 'οὐ']	['AuxY', 'AuxZ']
1171	194	1.3.18	καὶ τοὺς μὲν μαινομένους ᾤετο συμφερόντως ἂν δεδέσθαι καὶ ἑαυτοῖς καὶ τοῖς φίλοις , τοὺς δὲ μὴ ἐπισταμένους τὰ δέοντα δικαίως ἂν μανθάνειν παρὰ τῶν ἐπισταμένων .		rather, I think we should send to Cyrus men of the proper sort, along with Clearchus, to ask him what use he wishes to make of us;	['φίλος', 'μέν', 'δίκαιος', 'παρά']	4	['φίλοις', 'μὲν', 'δικαίως', 'παρὰ']	['CO', 'AuxY', 'ADV', 'AuxP']
1172	200	1.3.20	καὶ πρὸς τούτοις γε δή , ὅτι τῆς ψυχῆς ἐξελθούσης , ἐν ᾗ μόνῃ γίγνεται φρόνησις , τὸ σῶμα τοῦ οἰκειοτάτου ἀνθρώπου τὴν ταχίστην ἐξενέγκαντες ἀφανίζουσιν .		This plan was adopted, and they chose representatives and sent them with Clearchus; and they proceeded to put to Cyrus the questions resolved upon by the army.	['ἄνθρωπος', 'ἐν']	2	['ἀνθρώπου', 'ἐν']	['ATR', 'AuxP']
1173	209	1.4.1	τὸ δὲ Ὀμήρου ἔφη ὁ κατήγορος πολλάκις αὐτὸν λέγειν , ὅτι Ὀδυσσεὺς ὅντινα μὲν βασιλῆα καὶ ἔξοχον ἄνδρα κιχείη , τὸν δ’ ἀγανοῖς ἐπέεσσιν ἐρητύσασκε παραστάς ·		Thence he marched two stages, ten parasangs, to the Psarus river, the width of which was three plethra.	['μέν']	1	['μὲν']	['AuxY']
1174	227	1.4.6	κατὰ γὰρ τοὺς νόμους , ἐάν τις φανερὸς γένηται κλέπτων ἢ λωποδυτῶν ἢ βαλλαντιοτομῶν ἢ τοιχωρυχῶν ἢ ἀνδραποδιζόμενος ἢ ἱεροσυλῶν , τούτοις θάνατός ἐστιν ἡ ζημία ·		Thence Cyrus marched one stage, five parasangs, to Myriandus, a city on the sea coast, inhabited by Phoenicians;	['γάρ']	1	['γὰρ']	['AuxY']
1175	245	1.4.9	καδδύναμιν δ’ ἔρδειν ἱέρ’ ἀθανάτοισι θεοῖσι , καὶ πρὸς φίλους δὲ καὶ ξένους καὶ πρὸς τὴν ἄλλην δίαιταν καλὴν ἔφη παραίνεσιν εἶναι τὴν καδδύναμιν δ’ ἔρδειν .		After this Cyrus marched four stages, twenty parasangs, to the Chalus river, which is a plethrum in width and full of large, tame fish; these fish the Syrians regarded as gods, and they would not allow anyone to harm them, or the doves, either.	['φίλος', 'καλός']	2	['φίλους', 'καλὴν']	['ADV', 'ATR']
1176	363	1.6.7	εἰ οὖν ὥσπερ καὶ τῶν ἄλλων ἔργων οἱ διδάσκαλοι τοὺς μαθητὰς μιμητὰς ἑαυτῶν ἀποδεικνύουσιν , οὕτω καὶ σὺ τοὺς συνόντας διαθήσεις , νόμιζε κακοδαιμονίας διδάσκαλος εἶναι .		No, Orontas answered.	['ἔργον']	1	['ἔργων']	['ATR']
1177	380	1.6.9	ἐὰν δὲ δὴ φίλους ἢ πόλιν ὠφελεῖν δέῃ , ποτέρῳ ἡ πλείων σχολὴ τούτων ἐπιμελεῖσθαι , τῷ ὡς ἐγὼ νῦν ἢ τῷ ὡς σὺ μακαρίζεις διαιτωμένῳ ;		My advice is to put this man out of the way as speedily as possible, so that we may no longer have to be on our guard against the fellow, but may be left free, so far as concerns him, to requite with benefits these willing servants.	['φίλος']	1	['φίλους']	['OBJ']
1178	515	1.9.5	ὡς δ’ ἐγένοντο πλησιαίτερον τοῦ Ἡρακλέους , τὴν μὲν πρόσθεν ῥηθεῖσαν ἰέναι τὸν αὐτὸν τρόπον , τὴν δ’ ἑτέραν φθάσαι βουλομένην προσδραμεῖν τῷ Ἡρακλεῖ καὶ εἰπεῖν ·		Here, then, Cyrus was reputed to be, in the first place, the most modest of his fellows, and even more obedient to his elders than were his inferiors in rank; secondly, the most devoted to horses and the most skilful in managing horses;	['μέν']	1	['μὲν']	['AuxY']
1179	558	1.9.28	αἰσθόμενος δέ ποτε Λαμπροκλέα τὸν πρεσβύτατον υἱὸν αὐτοῦ πρὸς τὴν μητέρα χαλεπαίνοντα , εἰπέ μοι , ἔφη , ὦ παῖ , οἶσθά τινας ἀνθρώπους ἀχαρίστους καλουμένους ;		And whenever he was on the march and was likely to be seen by very many people, he would call his friends to him and engage them in earnest conversation, in order to show whom he honoured.	['ἄνθρωπος']	1	['ἀνθρώπους']	['OBJ']
1180	575	1.10.4	καὶ μὴν οὐ τῶν γε ἀφροδισίων ἕνεκα παιδοποιεῖσθαι τοὺς ἀνθρώπους ὑπολαμβάνεις , ἐπεὶ τούτου γε τῶν ἀπολυσόντων μεσταὶ μὲν αἱ ὁδοί , μεστὰ δὲ τὰ οἰκήματα .		At this time the King and the Greeks were distant from one another about thirty stadia, the Greeks pursuing the troops in their front, in the belief that they were victorious over all the enemy, the King and his followers plundering, in the belief that they were all victorious already.	['ἄνθρωπος', 'μέν', 'οὐ', 'ὁδός']	4	['ἀνθρώπους', 'μὲν', 'οὐ', 'ὁδοί']	['SBJ', 'ADV/AuxY', 'AuxZ', 'ADV/SBJ']
1181	591	1.10.12	ἀλλ’ , οἶμαι , ἐπειδὴ οὐκ οἴονται τῶν λεγόντων οὔτε τὸν ἐλέγχοντα ἐλέγχειν ἵνα ζημιώσῃ οὔτε τὸν ἀπειλοῦντα ἀπειλεῖν ἵνα κακόν τι ποιήσῃ , ῥᾳδίως φέρουσι .		They did see, they said, the royal standard, a kind of golden eagle on a shield, raised aloft upon a pole.	['ἀλλά', 'οὐ']	2	['ἀλλ’', 'οὐκ']	['AuxY', 'AuxZ']
1201	223	1.4.4	Λίχας μὲν γὰρ ταῖς γυμνοπαιδίαις τοὺς ἐπιδημοῦντας ἐν Λακεδαίμονι ξένους ἐδείπνιζε , Σωκράτης δὲ διὰ παντὸς τοῦ βίου τὰ ἑαυτοῦ δαπανῶν τὰ μέγιστα πάντας τοὺς βουλομένους ὠφέλει ·		or the pass was narrow, the walls reached down to the sea, and above the pass were precipitous rocks.	['διά', 'γάρ', 'ἐν', 'μέν']	4	['διὰ', 'γὰρ', 'ἐν', 'μὲν']	['AuxP', 'AuxY', 'AuxP', 'AuxY']
1202	315	1.5.8	καὶ ὁ Ἀριστόδημος , οὔτοι , ἔφη , ἐγώ , ὦ Σώκρατες , ὑπερορῶ τὸ δαιμόνιον , ἀλλ’ ἐκεῖνο μεγαλοπρεπέστερον ἡγοῦμαι ἢ ὡς τῆς ἐμῆς θεραπείας προσδεῖσθαι .		and leaping at once, with all this finery, into the mud, they lifted the wagons high and dry and brought them out more quickly than one would have thought possible.	['ἀλλά']	1	['ἀλλ’']	['AuxY']
1203	352	1.6.3	ἐμοὶ μὲν δοκεῖ νὴ τὴν Ἥραν ἐλευθέρῳ μὲν ἀνδρὶ εὐκτὸν εἶναι μὴ τυχεῖν δούλου τοιούτου , δουλεύοντα δὲ ταῖς τοιαύταις ἡδοναῖς ἱκετευτέον τοὺς θεοὺς δεσποτῶν ἀγαθῶν τυχεῖν ·		This letter he gave to a man whom he supposed to be faithful to him;	['ἀγαθός', 'μέν']	2	['ἀγαθῶν', 'μὲν']	['ATR', 'AuxY']
1204	367	1.6.7	πότερον ὅτι τοῖς μὲν λαμβάνουσιν ἀργύριον ἀναγκαῖόν ἐστιν ἀπεργάζεσθαι τοῦτο ἐφ’ ᾧ ἂν μισθὸν λάβωσιν , ἐμοὶ δὲ μὴ λαμβάνοντι οὐκ ἀνάγκη διαλέγεσθαι ᾧ ἂν μὴ βούλωμαι ;		Did you not, Cyrus said, when once more you had learned the slightness of your own power, go to the altar of Artemis and say you were sorry, and did you not, after prevailing upon me to pardon you, again give me pledges and receive pledges from me?	['μέν', 'οὐ']	2	['μὲν', 'οὐκ']	['AuxY', 'CO/AuxZ']
1205	372	1.6.8	τά γε μὴν ἱμάτια οἶσθ’ ὅτι οἱ μεταβαλλόμενοι ψύχους καὶ θάλπους ἕνεκα μεταβάλλονται , καὶ ὑποδήματα ὑποδοῦνται , ὅπως μὴ διὰ τὰ λυποῦντα τοὺς πόδας κωλύωνται πορεύεσθαι ·		I cannot choose but do so, said Orontas.	['διά']	1	['διὰ']	['AuxP']
1206	412	1.7.8	ἆρ’ οὐκ ἄν , εἰ μὲν ἐπιθυμῶν τοῦ δοκεῖν ἱκανὸς εἶναι ταῦτα πράττειν μὴ δύναιτο πείθειν , τοῦτ’ εἴη λυπηρόν , εἰ δὲ πείσειεν , ἔτι ἀθλιώτερον ;		and he satisfied the expectations of every one of them before dismissing them.	['μέν', 'οὐ']	2	['μὲν', 'οὐκ']	['AuxY', 'AuxZ']
1222	34	1.1.11	πρῴ τε γὰρ εἰς τοὺς περιπάτους καὶ τὰ γυμνάσια ᾔει καὶ πληθούσης ἀγορᾶς ἐκεῖ φανερὸς ἦν , καὶ τὸ λοιπὸν ἀεὶ τῆς ἡμέρας ἦν ὅπου πλείστοις μέλλοι συνέσεσθαι ·		He also directed Sophaenetus the Stymphalian and Socrates the Achaean, who were likewise friends of his, to come with as many men as they could get, saying that he intended to make war upon Tissaphernes with the aid of the Milesian exiles;	['λοιπός', 'εἰς', 'γάρ', 'ἀγορά', 'ἡμέρα']	5	['λοιπὸν', 'εἰς', 'γὰρ', 'ἀγορᾶς', 'ἡμέρας']	['ADV', 'AuxP', 'AuxY', 'SBJ', 'ATR']
1223	84	1.2.12	ᾔδεσαν δὲ Σωκράτην ἀπ’ ἐλαχίστων μὲν χρημάτων αὐταρκέστατα ζῶντα , τῶν ἡδονῶν δὲ πασῶν ἐγκρατέστατον ὄντα , τοῖς δὲ διαλεγομένοις αὐτῷ πᾶσι χρώμενον ἐν τοῖς λόγοις ὅπως βούλοιτο .		At any rate, Cyrus paid the troops at that time four months’ wages.	['ἀπό', 'λόγος', 'ἐν', 'μέν']	4	['ἀπ’', 'λόγοις', 'ἐν', 'μὲν']	['AuxP', 'ADV', 'AuxP', 'AuxY']
1224	119	1.2.21	τίς μὲν γὰρ αὐλητής , τίς δὲ κιθαριστής , τίς δὲ ἄλλος διδάσκαλος ἱκανοὺς ποιήσας τοὺς μαθητάς , ἐὰν πρὸς ἄλλους ἐλθόντες χείρους φανῶσιν , αἰτίαν ἔχει τούτου ;		Therefore Cyrus remained for a day in the plain.	['γάρ', 'μέν']	2	['γὰρ', 'μὲν']	['AuxY', 'AuxY']
1225	234	1.4.8	ὡς δὲ δὴ καὶ ὠφελεῖν ἐδόκει μοι τοὺς συνόντας τὰ μὲν ἔργῳ δεικνύων ἑαυτὸν οἷος ἦν , τὰ δὲ καὶ διαλεγόμενος , τούτων δὴ γράψω ὁπόσα ἂν διαμνημονεύσω .		Xenias and Pasion have deserted us.	['μέν', 'ἔργον']	2	['μὲν', 'ἔργῳ']	['AuxY', 'ADV']
1226	284	1.5.1	περὶ μὲν δὴ βρώσεως καὶ πόσεως καὶ ἀφροδισίων οὕτω κατεσκευασμένος ἦν καὶ ᾤετο οὐδὲν ἂν ἧττον ἀρκούντως ἥδεσθαι τῶν πολλὰ ἐπὶ τούτοις πραγματευομένων , λυπεῖσθαι δὲ πολὺ ἔλαττον .		and whatever else there was on the plain by way of shrub or reed, was always fragrant, like spices;	['μέν']	1	['μὲν']	['AuxY']
1227	311	1.5.7	νοῦν δὲ μόνον ἄρα οὐδαμοῦ ὄντα σε εὐτυχῶς πως δοκεῖς συναρπάσαι , καὶ τάδε τὰ ὑπερμεγέθη καὶ πλῆθος ἄπειρα δι’ ἀφροσύνην τινά , ὡς οἴει , εὐτάκτως ἔχειν ;		Once in particular, when they came upon a narrow, muddy place which was hard for the wagons to get through, Cyrus halted with his train of nobles and dignitaries and ordered Glus and Pigres to take some of the barbarian troops and help to pull the wagons out.	['διά']	1	['δι’']	['AuxP']
1228	321	1.5.10	ἔπειτα τοῖς μὲν ἄλλοις ἑρπετοῖς πόδας ἔδωκαν , οἳ τὸ πορεύεσθαι μόνον παρέχουσιν , ἀνθρώπῳ δὲ καὶ χεῖρας προσέθεσαν , αἳ τὰ πλεῖστα οἷς εὐδαιμονέστεροι ἐκείνων ἐσμὲν ἐξεργάζονται .		on these they would cross and get provisions—wine made from the date of the palm tree and bread made of millet.	['ἄνθρωπος', 'μέν']	2	['ἀνθρώπῳ', 'μὲν']	['OBJ', 'AuxY']
1229	329	1.5.12	οὔτε γὰρ βοὸς ἂν ἔχων σῶμα , ἀνθρώπου δὲ γνώμην ἐδύνατ’ ἂν πράττειν ἃ ἐβούλετο , οὔθ’ ὅσα χεῖρας ἔχει , ἄφρονα δ’ ἐστί , πλέον οὐδὲν ἔχει .		Now this man missed him.	['ἄνθρωπος', 'γάρ']	2	['ἀνθρώπου', 'γὰρ']	['ATR', 'AuxY']
1230	397	1.7.4	καὶ τοὺς θησαυροὺς τῶν πάλαι σοφῶν ἀνδρῶν , οὓς ἐκεῖνοι κατέλιπον ἐν βιβλίοις γράψαντες , ἀνελίττων κοινῇ σὺν τοῖς φίλοις διέρχομαι , καὶ ἄν τι ὁρῶμεν ἀγαθὸν ἐκλεγόμεθα ·		And now, in order that you may know what sort of a contest it is into which you are going, I who do know will tell you.	['φίλος', 'ἐν', 'ἀγαθός']	3	['φίλοις', 'ἐν', 'ἀγαθὸν']	['ADV', 'AuxP', 'ATR']
1231	440	1.7.19	τούτων γὰρ δήπου τὰ μὲν γαστρὶ δελεαζόμενα , καὶ μάλα ἔνια δυσωπούμενα , ὅμως τῇ ἐπιθυμίᾳ τοῦ φαγεῖν ἀγόμενα πρὸς τὸ δέλεαρ ἁλίσκεται , τὰ δὲ ποτῷ ἐνεδρεύεται .		But since the King did not appear at the trench and try to prevent the passage of Cyrus’ army, both Cyrus and the rest concluded that he had given up the idea of fighting.	['γάρ', 'μέν']	2	['γὰρ', 'μὲν']	['AuxY', 'AuxY']
1232	592	1.10.13	σὺ δ’ εὖ εἰδὼς ὅτι ἃ λέγει σοι ἡ μήτηρ οὐ μόνον οὐδὲν κακὸν νοοῦσα λέγει , ἀλλὰ καὶ βουλομένη σοι ἀγαθὰ εἶναι ὅσα οὐδενὶ ἄλλῳ , χαλεπαίνεις ;		But when at this point also the Greeks resumed their forward movement, the horsemen at once proceeded to leave the hill;	['ἀλλά', 'ἀγαθός', 'οὐ']	3	['ἀλλὰ', 'ἀγαθὰ', 'οὐ']	['AuxY', 'PNOM', 'AuxZ']
1233	604	1.10.17	συνοδοιπόρον ἢ σύμπλουν , ἢ εἴ τῳ ἄλλῳ ἐντυγχάνοις , οὐδὲν ἄν σοι διαφέροι φίλον ἢ ἐχθρὸν γενέσθαι , ἢ καὶ τῆς παρὰ τούτων εὐνοίας οἴει δεῖν ἐπιμελεῖσθαι ;		They reached their tents about supper-time.	['φίλος', 'παρά']	2	['φίλον', 'παρὰ']	['PNOM', 'AuxP']
1249	10	1.1.4	οὗτοί τε γὰρ ὑπολαμβάνουσιν οὐ τοὺς ὄρνιθας οὐδὲ τοὺς ἀπαντῶντας εἰδέναι τὰ συμφέροντα τοῖς μαντευομένοις , ἀλλὰ τοὺς θεοὺς διὰ τούτων αὐτὰ σημαίνειν , κ- ἐκεῖνος δὲ οὕτως ἐνόμιζεν .		He had, in the first place, the support of Parysatis, his mother, for she loved him better than the son who was king, Artaxerxes.	['ἀλλά', 'διά', 'γάρ', 'οὐ']	4	['ἀλλὰ', 'διὰ', 'γὰρ', 'οὐ']	['AuxY', 'AuxP', 'AuxY', 'AuxZ']
