1389	127	1.2.24	τοῦ δὲ Κριτίου τοῖς τοιούτοις οὐχ ὑπακούοντος οὐδὲ ἀποτρεπομένου , λέγεται τὸν Σωκράτην ἄλλων τε πολλῶν παρόντων καὶ τοῦ Εὐθυδήμου εἰπεῖν ὅτι ὑικὸν αὐτῷ δοκοίη πάσχειν ὁ Κριτίας , ἐπιθυμῶν Εὐθυδήμῳ προσκνῆσθαι ὥσπερ τὰ ὕδια τοῖς λίθοις .		The inhabitants of this city had abandoned it and fled, with Syennesis, to a stronghold upon the mountains—all of them, at least, except the tavern-keepers.	['λίθος', 'οὐ']	2	['λίθοις', 'οὐχ']	['ADV', 'AuxZ']
1390	205	1.3.21	ἔφη δ’ αὐτὸν ὁ κατήγορος καὶ τῶν ἐνδοξοτάτων ποιητῶν ἐκλεγόμενον τὰ πονηρότατα καὶ τούτοις μαρτυρίοις χρώμενον διδάσκειν τοὺς συνόντας κακούργους τε εἶναι καὶ τυραννικούς , Ἡσιόδου μὲν τὸ ἔργον δ’ οὐδὲν ὄνειδος , ἀεργίη δέ τ’ ὄνειδος ·		They, while suspecting that Cyrus was leading them against the King, nevertheless thought it best to follow him.	['μέν', 'ἔργον']	2	['μὲν', 'ἔργον']	['AuxY', 'CO/SBJ']
1391	377	1.6.9	καὶ μὴν τοῦτό γε οἶσθα , ὅτι οἱ μὲν οἰόμενοι μηδὲν εὖ πράττειν οὐκ εὐφραίνονται , οἱ δὲ ἡγούμενοι καλῶς προχωρεῖν ἑαυτοῖς ἢ γεωργίαν ἢ ναυκληρίαν ἢ ἄλλ’ ὅ τι ἂν τυγχάνωσιν ἐργαζόμενοι ὡς εὖ πράττοντες εὐφραίνονται .		Such have been this man’s deeds, such are now his words.	['μέν', 'οὐ', 'καλός']	3	['μὲν', 'οὐκ', 'καλῶς']	['AuxY', 'AuxZ', 'ADV']
1392	394	1.7.3	τήν τε γὰρ ὥραν ἐὰν μέν τις ἀργυρίου πωλῇ τῷ βουλομένῳ , πόρνον αὐτὸν ἀποκαλοῦσιν , ἐὰν δέ τις , ὃν ἂν γνῷ καλόν τε κ- ἀγαθὸν ἐραστὴν ὄντα , τοῦτον φίλον ἑαυτῷ ποιῆται , σώφρονα νομίζομεν ·		Men of Greece, it is not because I have not barbarians enough that I have brought you hither to fight for me; but because I believe that you are braver and stronger than many barbarians, for this reason I took you also.	['φίλος', 'ἀγαθός', 'μέν', 'γάρ', 'καλός']	5	['φίλον', 'ἀγαθὸν', 'μέν', 'γὰρ', 'καλόν']	['OCOMP', 'CO', 'AuxY', 'AuxY', 'PNOM']
1393	495	1.8.24	ἐγὼ μὲν γὰρ οὐκ οἶδ’ ὅ τι διαφέρει τὸ αὐτὸ δέρμα ἑκόντα ἢ ἄκοντα μαστιγοῦσθαι ἢ ὅλως τὸ αὐτὸ σῶμα πᾶσι τοῖς τοιούτοις ἑκόντα ἢ ἄκοντα πολιορκεῖσθαι ἄλλο γε ἢ ἀφροσύνη πρόσεστι τῷ θέλοντι τὰ λυπηρὰ ὑπομένειν .		Thereupon Cyrus, seized with fear lest he might get in the rear of the Greek troops and cut them to pieces, charged to meet him;	['γάρ', 'μέν', 'οὐ']	3	['γὰρ', 'μὲν', 'οὐκ']	['AuxY', 'AuxY', 'AuxZ']
1394	574	1.10.3	ἃ δὴ καὶ οὕτως ἡμῖν δοκεῖ παντὸς ἄξια εἶναι ὥστε πάντες τὸ καταλιπεῖν αὐτὰ πάντων μάλιστα φεύγομεν , καὶ αἱ πόλεις ἐπὶ τοῖς μεγίστοις ἀδικήμασι ζημίαν θάνατον πεποιήκασιν ὡς οὐκ ἂν μείζονος κακοῦ φόβῳ τὴν ἀδικίαν παύσαντες .		nevertheless, they did not take to flight, but they saved this woman and, furthermore, whatever else came within their lines, whether persons or property, they saved all alike.	['ἄξιος', 'οὐ']	2	['ἄξια', 'οὐκ']	['PNOM', 'AuxZ']
1400	270	1.4.16	ἆρ’ οὐκ ἂν αὐτίκα μάλα δοῦλος μὲν εἶναι ἀντ’ ἐλευθέρου , πολλὰ δὲ δαπανᾶν εἰς βλαβερὰς ἡδονάς , πολλὴν δὲ ἀσχολίαν ἔχειν τοῦ ἐπιμεληθῆναί τινος καλοῦ κ- ἀγαθοῦ , σπουδάζειν δ’ ἀναγκασθῆναι ἐφ’ οἷς οὐδ’ ἂν μαινόμενος σπουδάσειεν ;		Soldiers, to-day I commend you;	['ἀγαθός', 'οὐ', 'μέν', 'εἰς', 'καλός']	5	['ἀγαθοῦ', 'οὐκ', 'μὲν', 'εἰς', 'καλοῦ']	['CO', 'AuxZ', 'AuxY', 'AuxP', 'ATR']
1401	461	1.8.10	ἐγώ τε γὰρ ἀξιῶ τοὺς θεράποντας ἐμοὶ μὲν ἄφθονα τὰ ἐπιτήδεια παρασκευάζειν , αὐτοὺς δὲ μηδενὸς τούτων ἅπτεσθαι , αἵ τε πόλεις οἴονται χρῆναι τοὺς ἄρχοντας ἑαυταῖς μὲν ὡς πλεῖστα ἀγαθὰ πορίζειν , αὐτοὺς δὲ πάντων τούτων ἀπέχεσθαι .		In front of them were the so-called scythe-bearing chariots, at some distance from one another;	['ἀγαθός', 'γάρ', 'μέν', 'ἐπιτήδειος']	4	['ἀγαθὰ', 'γὰρ', 'μὲν', 'ἐπιτήδεια']	['OBJ', 'AuxY', 'AuxY', 'OBJ']
1411	120	1.2.21	τίς δὲ πατήρ , ἐὰν ὁ παῖς αὐτοῦ συνδιατρίβων τῳ σωφρονῇ , ὕστερον δὲ ἄλλῳ τῳ συγγενόμενος πονηρὸς γένηται , τὸν πρόσθεν αἰτιᾶται , ἀλλ’ οὐχ ὅσῳ ἂν παρὰ τῷ ὑστέρῳ χείρων φαίνηται , τοσούτῳ μᾶλλον ἐπαινεῖ τὸν πρότερον ;		On the following day, however, a messenger came with word that Syennesis had abandoned the heights, because he had learned that Menon’s army was already in Cilicia, on his own side of the mountains, and because, further, he was getting reports that triremes belonging to the Lacedaemonians and to Cyrus himself were sailing around from Ionia to Cilicia under the command of Tamos.	['ἀλλά', 'οὐ', 'παρά']	3	['ἀλλ’', 'οὐχ', 'παρὰ']	['AuxY', 'AuxZ', 'AuxP']
1412	333	1.5.13	ὅταν δὲ Ἀθηναίοις , ἔφη , πυνθανομένοις τι διὰ μαντικῆς φράζωσιν , οὐ καὶ σοὶ δοκεῖς φράζειν αὐτούς , οὐδ’ ὅταν τοῖς Ἕλλησι τέρατα πέμποντες προσημαίνωσιν , οὐδ’ ὅταν πᾶσιν ἀνθρώποις , ἀλλὰ μόνον σὲ ἐξαιροῦντες ἐν ἀμελείᾳ κατατίθενται ;		the result was that these and Menon himself were thoroughly frightened and ran to their arms, though there were some who stood stock-still, nonplussed by the situation.	['οὐ', 'διά', 'ἐν', 'ἀλλά', 'ἄνθρωπος']	5	['οὐ', 'διὰ', 'ἐν', 'ἀλλὰ', 'ἀνθρώποις']	['AuxZ', 'AuxP', 'AuxP', 'AuxY', 'CO/OBJ']
1413	565	1.9.31	ἤδη δέ ποτ’ ἐσκέψω εἰ ἄρα , ὥσπερ τὸ ἀνδραποδίζεσθαι τοὺς μὲν φίλους ἄδικον εἶναι δοκεῖ , τοὺς δὲ πολεμίους δίκαιον εἶναι , οὕτω καὶ τὸ ἀχαριστεῖν πρὸς μὲν τοὺς φίλους ἄδικόν ἐστι , πρὸς δὲ τοὺς πολεμίους δίκαιον ;		When he died, namely, all his bodyguard of friends and table companions died fighting in his defence, with the exception of Ariaeus;	['φίλος', 'μέν', 'δίκαιος', 'πολέμιος']	4	['φίλους', 'μὲν', 'δίκαιον', 'πολεμίους']	['SBJ', 'AuxY', 'PNOM', 'SBJ']
1419	37	1.2.1	οὐδὲ γὰρ περὶ τῆς τῶν πάντων φύσεως , ᾗπερ τῶν ἄλλων οἱ πλεῖστοι , διελέγετο σκοπῶν ὅπως ὁ καλούμενος ὑπὸ τῶν σοφιστῶν κόσμος ἔχει καὶ τίσιν ἀνάγκαις ἕκαστα γίγνεται τῶν οὐρανίων , ἀλλὰ καὶ τοὺς φροντίζοντας τὰ τοιαῦτα μωραίνοντας ἀπεδείκνυε .		It was avowedly against them that he set about collecting both his barbarian and his Greek troops.	['ἀλλά', 'γάρ']	2	['ἀλλὰ', 'γὰρ']	['AuxY', 'AuxY']
1420	601	1.10.16	οὐκοῦν , ἔφη ὁ Σωκράτης , καὶ τῷ γείτονι βούλῃ σὺ ἀρέσκειν , ἵνα σοι καὶ πῦρ ἐναύῃ , ὅταν τούτου δέῃ , καὶ ἀγαθοῦ τέ σοι γίγνηται συλλήπτωρ καί , ἄν τι σφαλλόμενος τύχῃς , εὐνοϊκῶς ἐγγύθεν βοηθῇ σοι ;		for they did not know that he was dead, but conjectured that he had either gone off in pursuit or pushed on to occupy some point.	['ἀγαθός']	1	['ἀγαθοῦ']	['ATR']
1429	72	1.2.10	ἐγὼ δ’ οἶμαι τοὺς φρόνησιν ἀσκοῦντας καὶ νομίζοντας ἱκανοὺς ἔσεσθαι τὰ συμφέροντα διδάσκειν τοὺς πολίτας ἥκιστα γίγνεσθαι βιαίους , εἰδότας ὅτι τῇ μὲν βίᾳ πρόσεισιν ἔχθραι καὶ κίνδυνοι , διὰ δὲ τοῦ πείθειν ἀκινδύνως τε καὶ μετὰ φιλίας τ- αὐτὰ γίγνεται .		There he remained three days.	['διά', 'μέν', 'κίνδυνος', 'φιλία']	4	['διὰ', 'μὲν', 'κίνδυνοι', 'φιλίας']	['AuxP', 'AuxY', 'CO', 'CO']
1434	339	1.5.16	ἐμοὶ μὲν οὖν ταῦτα λέγων οὐ μόνον τοὺς συνόντας ἐδόκει ποιεῖν ὁπότε ὑπὸ τῶν ἀνθρώπων ὁρῷντο , ἀπέχεσθαι τῶν ἀνοσίων τε καὶ ἀδίκων καὶ αἰσχρῶν , ἀλλὰ καὶ ὁπότε ἐν ἐρημίᾳ εἶεν , ἐπείπερ ἡγήσαιντο μηδὲν ἄν ποτε ὧν πράττοιεν θεοὺς διαλαθεῖν .		For as certainly as you come to fighting with one another, you may be sure that on this very day I shall be instantly cut to pieces and yourselves not long after me;	['οὐ', 'ἐν', 'μέν', 'ἀλλά', 'ἄνθρωπος']	5	['οὐ', 'ἐν', 'μὲν', 'ἀλλὰ', 'ἀνθρώπων']	['AuxZ', 'AuxP', 'AuxY', 'AuxY', 'OBJ']
1435	341	1.5.17	ὦ ἄνδρες , εἰ πολέμου ἡμῖν γενομένου βουλοίμεθα ἑλέσθαι ἄνδρα , ὑφ’ οὗ μάλιστ’ ἂν αὐτοὶ μὲν σῳζοίμεθα , τοὺς δὲ πολεμίους χειροίμεθα , ἆρ’ ὅντινα ἂν αἰσθανοίμεθα ἥττω γαστρὸς ἢ οἴνου ἢ ἀφροδισίων ἢ πόνου ἢ ὕπνου , τοῦτον ἂν αἱροίμεθα ;		On hearing these words Clearchus came to his senses.	['πόλεμος', 'μέν', 'πολέμιος']	3	['πολέμου', 'μὲν', 'πολεμίους']	['SBJ', 'AuxY', 'OBJ']
1436	512	1.9.3	φησὶ γὰρ Ἡρακλέα , ἐπεὶ ἐκ παίδων εἰς ἥβην ὡρμᾶτο , ἐν ᾗ οἱ νέοι ἤδη αὐτοκράτορες γιγνόμενοι δηλοῦσιν εἴτε τὴν δι’ ἀρετῆς ὁδὸν τρέψονται ἐπὶ τὸν βίον εἴτε τὴν διὰ κακίας , ἐξελθόντα εἰς ἡσυχίαν καθῆσθαι ἀποροῦντα ποτέραν τῶν ὁδῶν τράπηται ·		There one may learn discretion and self-control in full measure, and nothing that is base can be either heard or seen.	['ὁδός', 'διά', 'ἐν', 'εἰς', 'ἐκ', 'γάρ']	6	['ὁδὸν', 'δι’', 'ἐν', 'εἰς', 'ἐκ', 'γὰρ']	['OBJ', 'AuxP', 'AuxP', 'AuxP', 'AuxP', 'AuxY']
1443	277	1.4.18	οὐκ οἶσθ’ ὅτι τοῦτο τὸ θηρίον , ὃ καλοῦσι καλὸν καὶ ὡραῖον , τοσούτῳ δεινότερόν ἐστι τῶν φαλαγγίων , ὅσῳ ἐκεῖνα μὲν ἁψάμενα , τοῦτο δὲ οὐδ’ ἁπτόμενον , ἐάν τις αὐτὸ θεᾶται , ἐνίησί τι καὶ πάνυ πρόσωθεν τοιοῦτον ὥστε μαίνεσθαι ποιεῖν ;		It seemed, accordingly, that here was a divine intervention, and that the river had plainly retired before Cyrus because he was destined to be king.	['μέν', 'οὐ', 'καλός']	3	['μὲν', 'οὐκ', 'καλὸν']	['AuxY', 'AuxZ', 'OCOMP']
1444	448	1.8.5	τὸ δὲ εἶναι μὲν τὰς ἀναγκαιοτάτας πλείστας πράξεις τοῖς ἀνθρώποις ἐν ὑπαίθρῳ , οἷον τάς τε πολεμικὰς καὶ τὰς γεωργικὰς καὶ τῶν ἄλλων οὐ τὰς ἐλαχίστας , τοὺς δὲ πολλοὺς ἀγυμνάστως ἔχειν πρός τε ψύχη καὶ θάλπη οὐ δοκεῖ σοι πολλὴ ἀμέλεια εἶναι ;		As for the barbarians, Paphlagonian horsemen to the number of a thousand took station beside Clearchus on the right wing, as did the Greek peltasts, on the left was Ariaeus, Cyrus’ lieutenant, with the rest of the barbarian army,	['ἄνθρωπος', 'ἐν', 'μέν', 'οὐ']	4	['ἀνθρώποις', 'ἐν', 'μὲν', 'οὐ']	['ADV', 'AuxP', 'AuxY', 'AuxZ']
1445	494	1.8.23	ἀλλὰ γάρ , ὦ Σώκρατες , οἱ εἰς τὴν βασιλικὴν τέχνην παιδευόμενοι , ἣν δοκεῖς μοι σὺ νομίζειν εὐδαιμονίαν εἶναι , τί διαφέρουσι τῶν ἐξ ἀνάγκης κακοπαθούντων , εἴ γε πεινήσουσι καὶ διψήσουσι καὶ ῥιγώσουσι καὶ ἀγρυπνήσουσι καὶ τ- ἄλλα πάντα μοχθήσουσιν ἑκόντες ;		Since, then, there was no one in his front to give battle to him or to the troops drawn up before him, he proceeded to wheel round his line with the intention of encircling the enemy.	['ἐκ', 'γάρ', 'εἰς', 'ἀλλά']	4	['ἐξ', 'γάρ', 'εἰς', 'ἀλλὰ']	['AuxP', 'AuxY', 'AuxP', 'AuxY']
1450	115	1.2.20	τοιούτων δὲ συμβάντων αὐτοῖν , καὶ ὠγκωμένω μὲν ἐπὶ γένει , ἐπηρμένω δ’ ἐπὶ πλούτῳ , πεφυσημένω δ’ ἐπὶ δυνάμει , διατεθρυμμένω δὲ ὑπὸ πολλῶν ἀνθρώπων , ἐπὶ δὲ πᾶσι τούτοις διεφθαρμένω καὶ πολὺν χρόνον ἀπὸ Σωκράτους γεγονότε , τί θαυμαστὸν εἰ ὑπερηφάνω ἐγενέσθην ;		During that time Cyrus put to death a Persian named Megaphernes, who was a wearer of the royal purple, and another dignitary among his subordinates, on the charge that they were plotting against him.	['ἄνθρωπος', 'ἀπό', 'μέν']	3	['ἀνθρώπων', 'ἀπὸ', 'μὲν']	['OBJ', 'AuxP', 'AuxY']
1451	217	1.4.3	ἀλλ’ ἔφη δεῖν τοὺς μήτε λόγῳ μήτ’ ἔργῳ ὠφελίμους ὄντας μήτε στρατεύματι μήτε πόλει μήτε αὐτῷ τῷ δήμῳ , εἴ τι δέοι , βοηθεῖν ἱκανούς , ἄλλως τ’ ἐὰν πρὸς τούτῳ καὶ θρασεῖς ὦσι , πάντα τρόπον κωλύεσθαι , κἂν πάνυ πλούσιοι τυγχάνωσιν ὄντες .		It was at Issus also that the Greek mercenaries who had been in the service of Abrocomas—four hundred hoplites—joined Cyrus, after deserting Abrocomas, and so bore a share in his expedition against the King.	['ἀλλά', 'λόγος', 'ἔργον']	3	['ἀλλ’', 'λόγῳ', 'ἔργῳ']	['AuxY', 'ADV', 'CO']
1452	395	1.7.3	καὶ τὴν σοφίαν ὡσαύτως τοὺς μὲν ἀργυρίου τῷ βουλομένῳ πωλοῦντας σοφιστὰς ὥσπερ πόρνους ἀποκαλοῦσιν , ὅστις δὲ ὃν ἂν γνῷ εὐφυᾶ ὄντα διδάσκων ὅ τι ἂν ἔχῃ ἀγαθὸν φίλον ποιεῖται , τοῦτον νομίζομεν , ἃ τῷ καλῷ κ- ἀγαθῷ πολίτῃ προσήκει , ταῦτα ποιεῖν .		Be sure, therefore, to be men worthy of the freedom you possess, upon the possession of which I congratulate you.	['φίλος', 'ἀγαθός', 'μέν', 'καλός']	4	['φίλον', 'ἀγαθὸν', 'μὲν', 'καλῷ']	['OCOMP', 'ATR', 'AuxY', 'ATR']
1453	472	1.8.15	ἀλλ’ ἐγώ τοι , ἔφη ὁ Ἀρίστιππος , οὐδὲ εἰς τὴν δουλείαν ἐμαυτὸν τάττω , ἀλλ’ εἶναί τίς μοι δοκεῖ μέση τούτων ὁδός , ἣν πειρῶμαι βαδίζειν , οὔτε δι’ ἀρχῆς οὔτε διὰ δουλείας , ἀλλὰ δι’ ἐλευθερίας , ἥπερ μάλιστα πρὸς εὐδαιμονίαν ἄγει .		and Cyrus pulled up his horse and bade Xenophon tell everybody that the sacrificial victims and omens were all favourable.	['ἀρχή', 'ὁδός', 'διά', 'εἰς', 'ἀλλά']	5	['ἀρχῆς', 'ὁδός', 'δι’', 'εἰς', 'ἀλλ’']	['ADV', 'SBJ', 'AuxP', 'AuxP', 'AuxY']
1457	53	1.2.6	θαυμάζω οὖν ὅπως ποτὲ ἐπείσθησαν Ἀθηναῖοι Σωκράτην περὶ θεοὺς μὴ σωφρονεῖν , τὸν ἀσεβὲς μὲν οὐδέν ποτε περὶ τοὺς θεοὺς οὔτ’ εἰπόντα οὔτε πράξαντα , τοιαῦτα δὲ καὶ λέγοντα καὶ πράττοντα περὶ θεῶν οἷά τις ἂν καὶ λέγων καὶ πράττων εἴη τε καὶ νομίζοιτο εὐσεβέστατος .		After crossing the Maeander he marched through Phrygia one stage, a distance of eight parasangs, to Colossae, an inhabited city, prosperous and large.	['μέν']	1	['μὲν']	['AuxY']
1458	497	1.8.25	ὁ Σωκράτης ἔφη , οὐ δοκεῖ σοι τῶν τοιούτων διαφέρειν τὰ ἑκούσια τῶν ἀκουσίων , ᾗ ὁ μὲν ἑκὼν πεινῶν φάγοι ἂν ὁπότε βούλοιτο καὶ ὁ ἑκὼν διψῶν πίοι καὶ τ- ἄλλα ὡσαύτως , τῷ δ’ ἐξ ἀνάγκης ταῦτα πάσχοντι οὐκ ἔξεστιν ὁπόταν βούληται παύεσθαι ;		But when they turned to flight, Cyrus’ six hundred, setting out in pursuit, became scattered also, and only a very few were left about him, chiefly his so-called table companions.	['μέν', 'ἐκ', 'οὐ']	3	['μὲν', 'ἐξ', 'οὐ']	['AuxY', 'AuxP', 'AuxZ']
1472	481	1.8.18	ἀλλὰ νῦν οἱ μὲν πολιτευόμενοι ἐν ταῖς πατρίσι καὶ νόμους τίθενται , ἵνα μὴ ἀδικῶνται , καὶ φίλους πρὸς τοῖς ἀναγκαίοις καλουμένοις ἄλλους κτῶνται βοηθούς , καὶ ταῖς πόλεσιν ἐρύματα περιβάλλονται , καὶ ὅπλα κτῶνται οἷς ἀμυνοῦνται τοὺς ἀδικοῦντας , καὶ πρὸς τούτοις ἄλλους ἔξωθεν συμμάχους κατασκευάζονται ·		And when, as they proceeded, a part of the phalanx billowed out, those who were thus left behind began to run;	['ἀλλά', 'φίλος', 'ἐν', 'μέν']	4	['ἀλλὰ', 'φίλους', 'ἐν', 'μὲν']	['AuxY', 'OBJ', 'AuxP', 'AuxY']
1478	191	1.3.17	ἀλλὰ Σωκράτης γ’ , ἔφη ὁ κατήγορος , τοὺς πατέρας προπηλακίζειν ἐδίδασκε , πείθων μὲν τοὺς συνόντας αὐτῷ σοφωτέρους ποιεῖν τῶν πατέρων , φάσκων δὲ κατὰ νόμον ἐξεῖναι παρανοίας ἑλόντι καὶ τὸν πατέρα δῆσαι , τεκμηρίῳ τούτῳ χρώμενος , ὡς τὸν ἀμαθέστερον ὑπὸ τοῦ σοφωτέρου νόμιμον εἴη δεδέσθαι .		my choice would be, in going off without Cyrus’ consent, to go off without his knowledge.	['ἀλλά', 'μέν']	2	['ἀλλὰ', 'μὲν']	['AuxY', 'AuxY']
1479	419	1.7.11	γνοὺς γάρ τινα τῶν συνόντων ἀκολαστοτέρως ἔχοντα πρὸς τὰ τοιαῦτα , εἰπέ μοι , ἔφη , ὦ Ἀρίστιππε , εἰ δέοι σε παιδεύειν παραλαβόντα δύο τῶν νέων , τὸν μέν , ὅπως ἱκανὸς ἔσται ἄρχειν , τὸν δ’ , ὅπως μηδ’ ἀντιποιήσεται ἀρχῆς , πῶς ἂν ἑκάτερον παιδεύοις ;		besides, there was a troop of six thousand horsemen, under the command of Artagerses.	['ἀρχή', 'γάρ', 'μέν']	3	['ἀρχῆς', 'γάρ', 'μέν']	['OBJ', 'AuxY', 'AuxY']
1480	500	1.8.27	ἔτι δὲ αἱ μὲν ῥᾳδιουργίαι καὶ ἐκ τοῦ παραχρῆμα ἡδοναὶ οὔτε σώματι εὐεξίαν ἱκαναί εἰσιν ἐνεργάζεσθαι , ὥς φασιν οἱ γυμνασταί , οὔτε ψυχῇ ἐπιστήμην ἀξιόλογον οὐδεμίαν ἐμποιοῦσιν , αἱ δὲ διὰ καρτερίας ἐπιμέλειαι τῶν καλῶν τε κ- ἀγαθῶν ἔργων ἐξικνεῖσθαι ποιοῦσιν , ὥς φασιν οἱ ἀγαθοὶ ἄνδρες .		While Cyrus was delivering his stroke, however, some one hit him a hard blow under the eye with a javelin;	['ἀγαθός', 'διά', 'μέν', 'ἐκ', 'ἔργον', 'καλός']	6	['ἀγαθῶν', 'διὰ', 'μὲν', 'ἐκ', 'ἔργων', 'καλῶν']	['CO', 'AuxP', 'AuxY', 'AuxP', 'OBJ', 'ATR']
1487	195	1.3.18	ἀλλὰ Σωκράτης γε , ἔφη ὁ κατήγορος , οὐ μόνον τοὺς πατέρας ἀλλὰ καὶ τοὺς ἄλλους συγγενεῖς ἐποίει ἐν ἀτιμίᾳ εἶναι παρὰ τοῖς ἑαυτῷ συνοῦσι , λέγων ὡς οὔτε τοὺς κάμνοντας οὔτε τοὺς δικαζομένους οἱ συγγενεῖς ὠφελοῦσιν , ἀλλὰ τοὺς μὲν οἱ ἰατροί , τοὺς δὲ οἱ συνδικεῖν ἐπιστάμενοι .		and if his enterprise is like the sort of one in which he employed mercenaries before, I think that we also should follow him and not be more cowardly than those who went up with him on the former occasion.	['οὐ', 'ἐν', 'μέν', 'παρά', 'ἀλλά']	5	['οὐ', 'ἐν', 'μὲν', 'παρὰ', 'ἀλλὰ']	['AuxZ', 'AuxP', 'AuxY', 'AuxP', 'AuxY']
1488	396	1.7.3	ἐγὼ δ’ οὖν καὶ αὐτός , ὦ Ἀντιφῶν , ὥσπερ ἄλλος τις ἢ ἵππῳ ἀγαθῷ ἢ κυνὶ ἢ ὄρνιθι ἥδεται , οὕτω καὶ ἔτι μᾶλλον ἥδομαι φίλοις ἀγαθοῖς , καὶ ἐάν τι ἔχω ἀγαθόν , διδάσκω , καὶ ἄλλοις συνίστημι παρ’ ὧν ἂν ἡγῶμαι ὠφελήσεσθαί τι αὐτοὺς εἰς ἀρετήν ·		For you may be certain that freedom is the thing I should choose in preference to all that I have and many times more.	['φίλος', 'ἀγαθός', 'ἵππος', 'εἰς', 'παρά']	5	['φίλοις', 'ἀγαθῷ', 'ἵππῳ', 'εἰς', 'παρ’']	['OBJ', 'ATR', 'OBJ', 'AuxP', 'AuxP']
1489	519	1.9.6	ἐὰν δέ ποτε γένηταί τις ὑποψία σπάνεως ἀφ’ ὧν ἔσται ταῦτα , οὐ φόβος μή σε ἀγάγω ἐπὶ τὸ πονοῦντα καὶ ταλαιπωροῦντα τῷ σώματι καὶ τῇ ψυχῇ ταῦτα πορίζεσθαι , ἀλλ’ οἷς ἂν οἱ ἄλλοι ἐργάζωνται , τούτοις σὺ χρήσῃ , οὐδενὸς ἀπεχόμενος ὅθεν ἂν δυνατὸν ᾖ τι κερδᾶναι .		Furthermore, the man who was the first to come to his assistance he made an object of envy to many.	['ἀλλά', 'ἀπό', 'οὐ']	3	['ἀλλ’', 'ἀφ’', 'οὐ']	['AuxY', 'AuxP', 'AuxZ']
1490	547	1.9.22	τιμῶμαι δὲ μάλιστα πάντων καὶ παρὰ θεοῖς καὶ παρὰ ἀνθρώποις οἷς προσήκω , ἀγαπητὴ μὲν συνεργὸς τεχνίταις , πιστὴ δὲ φύλαξ οἴκων δεσπόταις , εὐμενὴς δὲ παραστάτις οἰκέταις , ἀγαθὴ δὲ συλλήπτρια τῶν ἐν εἰρήνῃ πόνων , βεβαία δὲ τῶν ἐν πολέμῳ σύμμαχος ἔργων , ἀρίστη δὲ φιλίας κοινωνός .		Again, he received more gifts, I presume, than any other one man, and for many reasons;	['ἀγαθός', 'ἐν', 'μέν', 'φιλία', 'πόλεμος', 'ἔργον', 'ἄνθρωπος', 'παρά']	8	['ἀγαθὴ', 'ἐν', 'μὲν', 'φιλίας', 'πολέμῳ', 'ἔργων', 'ἀνθρώποις', 'παρὰ']	['ATR', 'AuxP', 'AuxY', 'ATR', 'ATR', 'ATR', 'CO', 'AuxP']
